,公司代號,公司名稱,發言日期,發言時間,主旨
0,1459,聯發,109/03/10,18:56:03,公告本公司董事會決議召開一○九年股東常會相關事宜
1,1459,聯發,109/03/10,18:56:53,本公司董事會決議不分派股利
2,1459,聯發,109/03/10,18:57:21,公告本公司新增資金貸與他人金額達 「公開發行公司資金貸與及背書保證處理準則」 第22條第一項第3款規定公告
3,1459,聯發,109/06/24,17:49:40,公告本公司一○九年股東常會重要決議事項
4,1459,聯發,109/07/03,17:12:20,公告本公司新增資金貸與他人金額達 「公開發行公司資金貸與及背書保證處理準則」 第22條第一項第3款規定公告
5,1459,聯發,109/08/11,18:44:54,依據「公開發行公司取得或處分資產處理準則」規定公告
6,1459,聯發,109/09/09,17:51:08,公告本公司新增資金貸與他人金額達 「公開發行公司資金貸與及背書保證處理準則」 第22條第一項第3款規定公告
7,1459,聯發,109/09/18,17:03:40,本公司受邀參加元大證券舉辦之【2020第二季聯合產業座談會】
8,1459,聯發,109/10/13,17:57:06,依據「公開發行公司取得或處份資產處理準則」公告
