,公司代號,公司名稱,發言日期,發言時間,主旨
0,1590,亞德客-KY,100/01/07,16:08:00,本公司99年12月於國內股票流通情形月報表
1,1590,亞德客-KY,100/01/24,09:06:10,公告本公司受邀參加元大證券舉辦之海外法人說明會相關資訊
2,1590,亞德客-KY,100/02/10,15:45:36,本公司100年1月於國內股票流通情形月報表
3,1590,亞德客-KY,100/02/10,16:49:29,公告本公司100年1月份自結合併營收
4,1590,亞德客-KY,100/02/10,23:13:49,本公司2/10公告100年1月自結合併營收，其較上月合併 營收成長百分比及較去年同期合併營收成長百分比誤植。
5,1590,亞德客-KY,100/03/09,09:41:51,本公司100年2月於國內股票流通情形月報表
6,1590,亞德客-KY,100/03/10,17:19:49,公告本公司100年2月份自結合併營收
7,1590,亞德客-KY,100/03/11,17:55:40,本公司董事會決議召開100年股東常會之相關事宜
8,1590,亞德客-KY,100/03/14,18:03:59,公告日本強震及海嘯對本公司財務與業務並無重大影響
9,1590,亞德客-KY,100/04/08,17:21:58,本公司100年3月於國內股票流通情形月報表
10,1590,亞德客-KY,100/04/08,17:28:11,公告本公司100年3月份自結合併營收
11,1590,亞德客-KY,100/04/15,19:02:13,公告本公司99年度合併財務報表
12,1590,亞德客-KY,100/04/19,09:51:30,公告本公司受邀參加由台灣證券交易所及元大證券所舉辦 的海外企業論壇
13,1590,亞德客-KY,100/04/21,18:33:36,公告本公司100年第一季自結損益
14,1590,亞德客-KY,100/04/25,14:55:25,澄清說明工商時報B4版關於本公司未來營收成長預估報導
15,1590,亞德客-KY,100/04/27,17:38:36,公告本公司董事會通過間接對大陸投資案
16,1590,亞德客-KY,100/04/27,17:38:49,公告本公司董事會通過間接對大陸投資案
17,1590,亞德客-KY,100/04/27,17:44:27,董事會決議發放現金股利
18,1590,亞德客-KY,100/05/09,16:28:42,公告本公司經會計師核閱之100年度第一季合併財務報表
19,1590,亞德客-KY,100/05/10,16:27:07,公告本公司100年4月份自結合併營收
20,1590,亞德客-KY,100/05/10,16:27:22,本公司100年4月於國內股票流通情形月報表
21,1590,亞德客-KY,100/05/19,15:26:07,公告本公司受邀參加德意志銀行舉辦之海外法人說明會相關資訊
22,1590,亞德客-KY,100/06/08,19:53:52,澄清說明經濟日報C7版關於本公司大股東投資恩德科技報導
23,1590,亞德客-KY,100/06/09,19:35:47,公告本公司100年股東常會重要決議事項
24,1590,亞德客-KY,100/06/09,19:43:22,公告本公司董事會決議配息基準日
25,1590,亞德客-KY,100/06/10,14:47:29,本公司100年5月於國內股票流通情形月報表
26,1590,亞德客-KY,100/06/10,15:20:28,公告本公司100年5月份自結合併營收
27,1590,亞德客-KY,100/06/15,08:16:52,本公司大股東股權轉讓說明
28,1590,亞德客-KY,100/06/16,08:19:03,公告本公司受邀參加6/20~6/22由摩根大通所舉辦 的海外法人說明會
29,1590,亞德客-KY,100/07/07,17:15:43,公告本公司100年6月份自結合併營收
30,1590,亞德客-KY,100/07/11,18:43:04,澄清說明工商時報B4版關於本公司未來營收成長預估報導
31,1590,亞德客-KY,100/07/13,13:28:34,補充澄清說明工商時報B4版關於本公司未來營收成長預估報導
32,1590,亞德客-KY,100/07/27,12:40:21,修正本公司九十九年度股東會年報資料
33,1590,亞德客-KY,100/08/10,09:38:21,公告本公司100年7月份自結合併營收
34,1590,亞德客-KY,100/08/12,17:27:00,本公司因配合會計師事務所內部調整而更換會計師
35,1590,亞德客-KY,100/08/12,17:28:32,本公司及子公司資金貸與他人之餘額達本公司最近期財務報表 淨值百分之二十以上
36,1590,亞德客-KY,100/08/12,17:28:50,本公司新增資金貸與金額達新臺幣一千萬元以上且達本公司最近 期財務報表淨值百分之二以上者。
37,1590,亞德客-KY,100/08/12,17:29:16,代本公司之子公司寧波亞德客自動化工業有限公司公告處分不動 產相關事宜
38,1590,亞德客-KY,100/08/12,17:29:41,代本公司之子公司亞德客(中國)有限公司公告取得不動產相關事宜
39,1590,亞德客-KY,100/08/17,17:21:21,本公司召開2011年第二季線上法說會相關資訊
40,1590,亞德客-KY,100/08/19,15:15:47,公告本公司經會計師核閱之100年度上半年度合併財務報表
41,1590,亞德客-KY,100/09/09,16:26:54,公告本公司100年8月份自結合併營收
42,1590,亞德客-KY,100/09/21,10:44:10,更正100年度8月份背書保證申報資料
43,1590,亞德客-KY,100/10/07,18:28:10,公告本公司100年9月份自結合併營收
44,1590,亞德客-KY,100/11/01,16:33:42,公告本公司董事會決議成立薪酬委員會及委任薪酬委員
45,1590,亞德客-KY,100/11/04,17:08:06,公告本公司受邀參加德意志銀行所舉辦的法人說明會
46,1590,亞德客-KY,100/11/04,17:08:38,公告本公司100年前三季自結損益
47,1590,亞德客-KY,100/11/10,18:23:04,公告本公司100年10月份自結合併營收
48,1590,亞德客-KY,100/11/10,18:38:07,公告本公司經會計師核閱之100年前三季合併財務報表
49,1590,亞德客-KY,100/12/01,18:21:43,代子公司公告-健良(上海)貿易有限公司董事會決議發放現金股利
50,1590,亞德客-KY,100/12/09,17:11:07,公告本公司100年11月份自結合併營收
51,1590,亞德客-KY,100/12/16,16:59:48,本公司新增資金貸與金額達新臺幣一千萬元以上且達本公司最近 期財務報表淨值百分之二以上者。
52,1590,亞德客-KY,100/12/26,11:37:18,公告本公司擬變更證券簡稱
53,1590,亞德客-KY,100/12/27,09:22:54,公告本公司擬變更證券簡稱
54,1590,亞德客-KY,100/12/28,13:05:20,公告本公司擬變更證券簡稱
55,1590,亞德客-KY,100/12/29,11:42:08,公告本公司擬變更證券簡稱
56,1590,亞德客-KY,100/12/30,09:10:53,公告本公司擬變更證券簡稱
57,1590,亞德客-KY,100/12/30,17:07:23,代子公司公告-寧波亞德客自動化工業有限公司董事會決議 不發放99年度盈餘
58,1590,亞德客-KY,100/12/30,17:07:44,代子公司公告-廣東亞德客自動化工業有限公司董事會決議 不發放99年度盈餘
