,公司代號,公司名稱,發言日期,發言時間,主旨
0,1731,美吾華,105/02/26,15:50:28,公告本公司董事會決議配發現金股息每股0.5元
1,1731,美吾華,105/02/26,15:52:04,公告本公司105年股東常會相關事宜。
2,1731,美吾華,105/02/26,15:53:20,公告本公司董事會通過一○四年度員工及董監事酬勞。
3,1731,美吾華,105/03/15,16:45:24,係因本公司有價證券於集中交易市場達公佈注意交易資訊標準 ，故公佈相關財務業務等重大訊息，以利投資人區別瞭解。
4,1731,美吾華,105/03/15,17:02:27,補充公告係因本公司有價證券於集中交易市場達公佈注意交易資訊 標準，故公佈相關財務業務等重大訊息，以利投資人區別瞭解。
5,1731,美吾華,105/03/30,14:07:46,公告本公司股務代理機構「福邦證券股份有限公司」 變更營業處所相關事宜
6,1731,美吾華,105/05/31,14:18:04,公告本公司105年股東常會重要決議事項
7,1731,美吾華,105/06/06,14:04:31,公告本公司現金股利除息基準日
8,1731,美吾華,105/08/10,13:55:47,公告本公司董事會增選副董事長
