,公司代號,公司名稱,發言日期,發言時間,主旨
0,2364,倫飛,102/02/08,09:51:51,公告本公司會計主管異動
1,2364,倫飛,102/02/25,08:49:51,公告本公司發行99年第一次私募無擔保可轉換公司債到期事宜。
2,2364,倫飛,102/03/13,16:33:18,公告本公司董事會決議102年不發放101年度特別股及普通股 股息、股利及紅利
3,2364,倫飛,102/03/13,16:38:14,公告本公司董事會決議召開102年股東常會相關事宜
4,2364,倫飛,102/03/13,16:44:36,公告本公司因會計師事務所內部調整須變更會計師
5,2364,倫飛,102/03/27,16:26:41,公告102/3/27地震對本公司之財務業務並無影響
6,2364,倫飛,102/04/22,14:15:35,公告增加本公司一○二年股東常會之召集事由。
7,2364,倫飛,102/05/31,10:17:26,公告本公司102年股東常會重要決議事項
8,2364,倫飛,102/05/31,10:19:07,公告本公司第十屆監察人補選當選名單
