,公司代號,公司名稱,發言日期,發言時間,主旨
0,2439,美律,105/01/06,20:45:40,公告本公司自行結算104年12月集團合併營收
1,2439,美律,105/01/22,16:01:12,公告本公司105年股東臨時會重要決議事項
2,2439,美律,105/01/22,16:01:31,公告本公司105年第一次股東臨時會補選監察人案
3,2439,美律,105/02/05,15:52:43,公告本公司自行結算105年01月集團合併營收
4,2439,美律,105/02/16,17:35:56,更正本公司105年1月資金貸與金額
5,2439,美律,105/02/22,18:38:40,代重要子公司美律電子(香港)有限公司董事會決議公告增資 美律電子(惠州)有限公司美金100萬元
6,2439,美律,105/02/25,19:23:33,公告董事會通過2015年度決算表冊
7,2439,美律,105/02/25,19:23:59,公告董事會通過2015年員工及董監事酬勞
8,2439,美律,105/02/25,19:24:37,公告本公司董事會決議召開股東會事宜
9,2439,美律,105/02/25,19:29:07,103年度國內第一次無擔保可轉換公司債之計畫項目案 變更公告。
10,2439,美律,105/02/25,19:29:39,公告本公司董事會決議私募發行普通股定價相關事宜
11,2439,美律,105/03/07,18:35:58,公告本公司自行結算105年02月集團合併營收
12,2439,美律,105/03/14,17:14:24,本公司受邀參加美林證券舉辦之2016 Asia Pacific TMT Conference (TTB)
13,2439,美律,105/04/06,20:31:26,公告本公司自行結算105年03月集團合併營收
14,2439,美律,105/05/05,19:03:49,公告本公司自行結算105年04月集團合併營收
15,2439,美律,105/05/09,18:14:02,董事會決議股利分派
16,2439,美律,105/05/09,18:15:29,公告本公司經董事會決議通過間接增資重要子公司 美特科技(蘇州)有限公司現金增資事宜。
17,2439,美律,105/05/09,18:15:50,公告本公司2016年股東常會提名獨立董事候選人名單
18,2439,美律,105/05/09,18:18:29,公告本公司董事會決議發行限制員工權利新股案
19,2439,美律,105/05/09,18:18:51,公告本公司董事會決議為變更2016年股東常會召集事由
20,2439,美律,105/05/19,18:33:30,補充公告本公司2016年股東常會提名獨立董事候選人名單之 經歷及現職
21,2439,美律,105/05/20,17:53:56,本公司受邀參加德意志證券105/05/23-105/05/25舉辦之dbAccess Asia Conference 2016。
22,2439,美律,105/06/04,16:01:10,公告本公司自行結算105年05月集團合併營收
23,2439,美律,105/06/13,16:51:15,本公司受邀參加永豐金證券舉辦之「新興亞洲優勢產業論壇」。
24,2439,美律,105/06/20,18:27:23,公告子公司美律電子(香港)有限公司新增資金 貸與金額達公開發行公司資金貸與及背書保證 處理準則第22條第1項第3款之公告標準。
25,2439,美律,105/06/22,17:13:06,本公司受邀參加UBS舉辦之「Taiwan Conference 2016」。
26,2439,美律,105/06/29,17:43:42,本公司受邀參加統一證劵舉辦之「2016年下半年-投資展望趨勢論壇」
27,2439,美律,105/06/29,17:44:17,公告本公司105年股東常會重要決議事項
28,2439,美律,105/06/29,17:44:46,公告本公司董監事任期屆滿全面改選
29,2439,美律,105/06/29,17:45:01,公告本公司105年股東常會決議解除新任董事競業禁止限制案
30,2439,美律,105/06/30,19:59:23,有關投審會駁回香港商立訊精密有限公司認購本公司 私募普通股一案說明
31,2439,美律,105/07/05,18:11:03,公告本公司自行結算105年06月集團合併營收
32,2439,美律,105/07/11,18:56:26,公司董事會通過廖祿立、魏文傑先生續任為董事長、 副董事長
33,2439,美律,105/07/11,18:56:44,公告本公司105年除息基準日
34,2439,美律,105/07/11,18:57:02,公告本公司董事會決議委任第三屆薪資報酬委員會委員
35,2439,美律,105/07/18,19:35:53,公告本公司及重要子公司美特科技(香港)有限公司董事會決議 美特科技(香港)有限公司與立訊精密工業股份有限公司簽訂 投資合作意向書案
36,2439,美律,105/07/20,15:05:22,公告本公司調整104年度現金股利配息率
37,2439,美律,105/07/21,16:18:30,公告本公司發行國內第一次無擔保轉換公司債轉換價格 之調整
38,2439,美律,105/07/26,18:41:38,公告更正本公司104年度年報部份內容
39,2439,美律,105/08/04,18:14:06,公告本公司自行結算105年07月集團合併營收
40,2439,美律,105/08/09,19:18:55,"董事會決議撤銷原2016年5月9日董事會通過對其曾孫公司 美特科技(蘇州)有限公司現金增資美元10,000仟元案。"
41,2439,美律,105/08/09,19:19:22,公告本公司及重要子公司Danny Dynamics Ltd.、美特科技 (香港)有限公司及美特科技(蘇州)有限公司董事會決議通過對 美特科技(蘇州)有限公司現金增資。
42,2439,美律,105/08/09,19:19:38,公告本公司、重要子公司美特科技(香港)有限公司董事會決議 通過其轉投資美特科技(蘇州)有限公司之增資，全體董事放棄認購 增資股數達得認購股數二分之一以上，並洽由特定人認購者。
43,2439,美律,105/08/09,19:20:22,公告本公司及重要子公司美特科技(香港)有限公司董事會決議 美特科技(香港)有限公司與立訊精密工業股份有限公司子公司昆山 聯滔電子有限公司簽訂合資合同案
44,2439,美律,105/08/15,17:38:09,代重要子公司美特科技(香港)有限公司及美特科技(蘇州) 有限公司董事會通過美特科技（蘇州）有限公司董監事異動 達三分之一以上公告
45,2439,美律,105/08/15,17:38:30,代重要子公司美特科技(蘇州)有限公司董事會通過選任 董事長、副董事長
46,2439,美律,105/09/05,18:16:51,公告本公司自行結算105年08月集團合併營收
47,2439,美律,105/09/06,16:03:39,本公司受邀參加瑞士信貸證券舉辦之「17th Annual Asian Technology Conference」。
48,2439,美律,105/09/06,16:05:35,本公司受邀參加富邦證券舉辦之「2016年度第三季富邦投資論壇」
49,2439,美律,105/09/06,16:08:35,本公司受邀參加凱基證券舉辦之「凱基證券 第三季投資論壇」
50,2439,美律,105/10/03,13:38:46,澄清通信網路時報資訊105年10月3日之報導
51,2439,美律,105/10/03,17:04:52,本公司受邀參加野村證舉辦105/10/5-105/10/6之Taiwan Corporate Day 2016。
52,2439,美律,105/10/03,17:06:38,本公司受邀參加中國國際金融有限公司105/10/12-105/10/13舉辦之海外法人說明會
53,2439,美律,105/10/03,17:07:57,本公司受邀參加富邦證券105/10/17-105/10/20舉辦之海外投資人會議
54,2439,美律,105/10/05,17:30:41,公告本公司自行結算105年09月集團合併營收
55,2439,美律,105/10/27,17:36:22,本公司及代重要子公司美律電子(香港)有限公司及美律電子 (深圳)有限公司董事會通過美律電子(深圳)有限公司董監事代表人 異動公告
56,2439,美律,105/10/27,17:36:39,代重要子公司美律電子(深圳)有限公司法定代表人變更
57,2439,美律,105/10/28,11:54:59,澄清105年10月28日之經濟日報C3版報導
58,2439,美律,105/11/04,15:48:46,公告本公司自行結算105年10月集團合併營收
59,2439,美律,105/11/07,17:36:10,本公司受邀參加花旗證券舉辦105/11/10-105/11/11舉辦之海外法人說明會。
60,2439,美律,105/11/25,16:41:57,更正本公司105年9月關係人交易申報
61,2439,美律,105/11/25,17:39:58,本公司受邀參加統一證券舉辦之【2017金雞報喜投資展望論壇】
62,2439,美律,105/11/25,17:41:03,本公司受邀參加日盛證券舉辦之「日盛證券太陽獅 大中華冬季論壇」
63,2439,美律,105/12/05,17:03:48,公告本公司自行結算105年11月集團合併營收
64,2439,美律,105/12/16,19:37:39,公告本公司董事會決議投資英屬開曼群島商康而富控股股份 有限公司私募普通股及簽署股份買賣契約書
65,2439,美律,105/12/16,19:38:59,公告本公司董事會通過106年度對財團法人台灣閱讀文化 基金會捐贈
66,2439,美律,105/12/16,19:44:54,公告本公司105年度董事會決議第一次限制員工權利新股 之增資基準日
67,2439,美律,105/12/16,19:47:57,公告本公司董事會決議私募普通股案及簽署股份買賣契約書。
68,2439,美律,105/12/16,20:51:22,公告本公司董事會決議私募普通股案及簽署股份買賣契約書。
69,2439,美律,105/12/30,18:01:13,變更105年度第1次限制員工權利新股增資基準日及股數
