,公司代號,公司名稱,發言日期,發言時間,主旨
0,2468,華經,107/03/23,16:50:34,公告本公司董事會決議召開107年股東常會
1,2468,華經,107/03/23,16:51:20,董事會決議股利分派
2,2468,華經,107/06/15,18:04:33,公告本公司107年股東常會決議事項
3,2468,華經,107/07/09,17:58:56,公告本公司董事會決議現金股利配息基準日
4,2468,華經,107/07/09,18:01:23,公告本公司新增資金貸與他人金額達新台幣一千萬以上且達 最近期財務報表淨值百分之二以上。
5,2468,華經,107/10/17,16:36:25,係因本公司有價證券於集中交易市場達公布注意交易資訊 標準，故公布相關財務業務等重大訊息，以利投資人區別瞭解
6,2468,華經,107/11/28,17:23:04,107年第三季合併財務報告附註揭露事項資訊內容更正
7,2468,華經,107/12/04,16:28:18,公告本公司營運長異動
8,2468,華經,107/12/13,17:30:01,公告本公司受邀參加元大證券舉辦之法人說明會
