,公司代號,公司名稱,發言日期,發言時間,主旨
0,2537,聯上發,104/03/25,18:15:12,公告本公司董事會決議召開104年股東常會
1,2537,聯上發,104/03/25,20:21:17,董事會決議股利分派
2,2537,聯上發,104/06/15,14:51:56,公告本公司股東常會重要決議事項
3,2537,聯上發,104/06/16,11:01:13,澄清104/06/16自由時報C3版報導內容
4,2537,聯上發,104/06/18,13:31:17,103年度股東會年報(股東會後修訂)重新上傳
5,2537,聯上發,104/08/12,18:12:41,公告本公司董事會決議除權除息基準日
6,2537,聯上發,104/08/12,18:17:41,本公司與非關係人就新北市三重區三重段土地簽訂合建契約書
7,2537,聯上發,104/08/12,18:19:51,本公司與非關係人就新北市板橋區江翠段土地簽訂合建契約書
8,2537,聯上發,104/12/18,13:52:28,本公司擔任實施者之「臺北市士林區天母段三小段34地號等 2筆土地都市更新事業計畫及權利變換計畫案」核定實施公告
