,公司代號,公司名稱,發言日期,發言時間,主旨
0,2701,萬企,100/03/14,12:10:26,公告日本大地震對本公司無影響
1,2701,萬企,100/03/29,14:07:53,公告本公司董事會決議一百年股東常會日期等事宜
2,2701,萬企,100/03/29,14:10:25,公告本公司董事會決議九十九年盈餘分派
3,2701,萬企,100/03/29,14:13:09,增資發行新股
4,2701,萬企,100/06/24,10:58:34,本公司一百年股東常會重要決議事項公告
5,2701,萬企,100/07/04,16:02:39,係因本公司有價證券於集中交易市場達公布注意交易資訊標準， 故公布相關財務業務等重大訊息，以利投資人區別瞭解
6,2701,萬企,100/07/04,17:00:04,補正前次(係因本公司有價證券於集中交易市場達公布 注意交易資訊標準，故公布相關財務業務等重大訊息，以 利投資人區別瞭解。)格式調整公告
7,2701,萬企,100/08/23,11:56:43,公告本公司100年『配股、息基準日』
8,2701,萬企,100/12/19,15:00:41,公告本公司董事會通過薪資報酬委員會組織規程及聘任薪酬委員
