,公司代號,公司名稱,發言日期,發言時間,主旨
0,3051,力特,105/03/24,17:34:49,本公司董事會決議辦理減資彌補虧損案
1,3051,力特,105/03/24,17:41:12,公告本公司召開105年股東常會相關事宜
2,3051,力特,105/03/24,17:46:19,董事會決議不發放股利
3,3051,力特,105/03/25,11:26:20,本公司董事會決議辦理減資彌補虧損案 (補正前一日公告之董事會決議日期及事實發生日日期為105/3/24)
4,3051,力特,105/06/14,16:00:08,公告本公司民國105年6月14日股東常會重要決議事項
5,3051,力特,105/06/14,16:00:24,本公司辦理減資致債權人公告
6,3051,力特,105/09/20,10:39:00,澄清媒體報導-經濟日報
7,3051,力特,105/10/24,16:05:19,本公司已獲債權銀行同意債權債務協商事宜
8,3051,力特,105/12/29,16:23:57,係因本公司有價證券於集中交易市場達公布注意交易資訊 標準，故公布相關財務業務等重大訊息，以利投資人區別瞭解。
