,公司代號,公司名稱,發言日期,發言時間,主旨
0,3229,晟鈦,104/03/13,14:51:25,公告本公司董事會決議進行投資計畫金額達公司實收資本額百分 之二十以上
1,3229,晟鈦,104/03/16,10:02:50,公告本公司董事會決議通過擬以合資參股取得貴州神華宏易達煤業 有限公司51%股權
2,3229,晟鈦,104/03/30,14:47:44,公告本公司董事會決議召開104年股東常會相關事宜
3,3229,晟鈦,104/03/30,14:49:48,董事會決議股利分派
4,3229,晟鈦,104/03/30,15:40:51,更正本公司103年12月當月暨累計之合併營收公告資訊
5,3229,晟鈦,104/06/02,17:39:33,公告本公司赴大陸地區投資貴州神華宏易達煤業有限公司並取得其 51%股權(補充公告)
6,3229,晟鈦,104/06/26,15:31:47,公告本公司104年股東常會重要決議事項
7,3229,晟鈦,104/07/15,15:29:32,公告本公司對100%持有之子公司利成新增背書保證達「公開發行公 司資金貸與及背書保證處理準則」第二十五條第一項第三款標準。
8,3229,晟鈦,104/08/11,15:16:49,公告本公司各事業處專業經理人異動
