,公司代號,公司名稱,發言日期,發言時間,主旨
0,3706,神達,104/01/09,15:03:47,新聞稿-神達投控公佈一百零三年十二月營收
1,3706,神達,104/01/12,16:34:38,公告子公司神達電腦(股)公司庫藏股註銷本公司股份之 變更登記完成事宜
2,3706,神達,104/01/19,16:57:08,代子公司佛山市順德區順達電腦廠有限公司 公告一年內處分銀行結構性存款產品 累計金額達新臺幣達三億元以上
3,3706,神達,104/02/02,17:44:53,代子公司神達電腦(股)公司公告董事會通過自地委建企業總部大樓
4,3706,神達,104/02/02,20:16:54,公告董事會決議辦理子公司神達電腦(股)公司 庫藏股註銷本公司股份
5,3706,神達,104/02/09,16:42:34,新聞稿-神達投控公佈一百零四年一月營收
6,3706,神達,104/02/12,10:53:32,公告本公司減少持有被控股公司家數
7,3706,神達,104/03/09,15:30:07,新聞稿-神達投控公佈一百零四年二月營收
8,3706,神達,104/03/10,13:39:05,更正104年01月份代子公司申報之月營業收入資訊
9,3706,神達,104/03/19,16:12:51,公告董事會決議召開104年股東常會相關事宜
10,3706,神達,104/03/19,16:13:24,董事會決議股利分派
11,3706,神達,104/03/19,16:13:54,新聞稿-神達投控公佈一百零三年財務報告與股利配發案
12,3706,神達,104/03/19,16:14:25,代子公司神達電腦(股)公司及神雲科技(股)公司公告董事會 (代行股東會職權)重要決議事項
13,3706,神達,104/03/19,16:14:36,代子公司神達電腦(股)公司及神雲科技(股)公司 公告董事會決議股利分派
14,3706,神達,104/03/19,16:15:06,代本公司之子公司神達電腦(股)公司及神雲科技(股)公司 公告董事會決議盈餘轉增資發行新股
15,3706,神達,104/03/31,11:27:31,公告本公司103年第4季關係人交易申報數與會計師查核數差異說明
16,3706,神達,104/04/09,14:49:52,新聞稿-神達投控公佈一百零四年三月營收
17,3706,神達,104/04/13,16:02:42,公告子公司神達電腦(股)公司庫藏股註銷本公司股份之 變更登記完成事宜
18,3706,神達,104/04/17,16:15:46,代子公司佛山市順德區順達電腦廠有限公司公告一年內取得 銀行結構性存款產品累計金額達新臺幣三億元以上
19,3706,神達,104/04/28,17:23:14,公告本公司薪資報酬委員辭任
20,3706,神達,104/05/04,13:05:47,代子公司資豐投資(股)公司公告董事會決議股利分派
21,3706,神達,104/05/08,17:53:36,公告本公司董事會通過補行委任薪資報酬委員會成員
22,3706,神達,104/05/08,17:54:18,新聞稿-神達投控公佈一百零四年四月營收
23,3706,神達,104/05/08,17:55:04,新聞稿-神達投控公佈一百零四年第一季財務報告
24,3706,神達,104/05/18,17:21:16,本公司及子公司公告對單一企業背書保證餘額達新臺幣一千萬元 以上且對其背書保證、長期投資及資金貸與餘額合計數達本公司 最近其財務報表淨值百分之三十以上。
25,3706,神達,104/06/09,13:38:21,新聞稿-神達投控公佈一百零四年五月營收
26,3706,神達,104/06/11,18:00:55,公告本公司104年股東常會重要決議
27,3706,神達,104/06/11,18:01:49,公告本公司104年股東常會解除董事競業之限制
28,3706,神達,104/06/11,18:02:06,代子公司神達電腦(股)公司公告董事會代行  104年股東常會重要決議事項
29,3706,神達,104/06/11,18:02:34,代子公司神達電腦(股)公司公告董事會決議股利配發基準日
30,3706,神達,104/06/11,18:03:13,代子公司神雲科技(股)公司公告董事會  代行104年股東常會重要決議事項
31,3706,神達,104/06/11,18:04:42,代子公司神雲科技(股)公司公告董事會決議股利配發基準日
32,3706,神達,104/06/11,18:05:17,代子公司資豐投資(股)公司公告董事會  代行104年股東常會重要決議事項
33,3706,神達,104/06/11,18:05:57,代子公司資豐投資(股)公司公告董事會決議股利配發基準日
34,3706,神達,104/06/11,18:06:46,代子公司資豐投資(股)公司公告選任董事長
35,3706,神達,104/06/11,23:41:25,代子公司資豐投資(股)公司公告董監重新指派
36,3706,神達,104/06/11,23:57:32,代子公司資豐投資(股)公司公告解除董事競業之限制
37,3706,神達,104/06/12,18:28:25,董事會決議訂定配息基準日
38,3706,神達,104/06/12,18:29:05,公告本公司董事會決議新增資金貸與金額達新臺幣一千萬元 以上且達本公司最近期財務報表淨值百分之二以上
39,3706,神達,104/07/03,16:23:28,調整本公司現金股利配息率
40,3706,神達,104/07/09,14:17:11,新聞稿-神達投控公佈一百零四年六月營收
41,3706,神達,104/07/17,17:02:32,代子公司佛山市順德區順達電腦廠有限公司公告一年內處分 銀行結構性存款產品累計金額達新臺幣達三億元以上
42,3706,神達,104/08/09,21:03:24,公告本公司董事長兼任總執行長
43,3706,神達,104/08/09,21:04:42,代子公司神雲科技(股)公司公告董事長兼任執行長
44,3706,神達,104/08/09,21:08:37,公告董事會決議辦理子公司神達電腦(股)公司 庫藏股註銷本公司股份
45,3706,神達,104/08/09,21:10:31,新聞稿-神達投控公佈一百零四年上半年財務報告
46,3706,神達,104/08/09,21:11:03,解除本公司經理人競業之禁止
47,3706,神達,104/08/09,21:11:26,代子公司神雲科技(股)公司公告解除經理人競業之禁止案
48,3706,神達,104/08/09,21:11:44,代子公司神達電腦(股)公司公告大陸投資資訊
49,3706,神達,104/08/10,14:01:29,新聞稿-神達投控公佈一百零四年七月營收
50,3706,神達,104/08/14,17:13:42,本公司及子公司對單一企業資金貸與餘額達本公司 最近期財務報表淨值10%以上
51,3706,神達,104/08/25,16:53:44,公告本公司董事會通過買回公司股份
52,3706,神達,104/08/27,13:47:26,代子公司神達電腦(股)公司及神雲科技(股)公司公告 董事會(代行股東會職權)重要決議事項
53,3706,神達,104/09/01,17:24:57,補充說明本公司於104年2月2日代子公司神達電腦(股)公司 公告自地委建企業總部大樓之相關事宜
54,3706,神達,104/09/09,16:07:31,新聞稿-神達投控公佈一百零四年八月營收
55,3706,神達,104/09/14,17:28:19,公告本公司辦理註銷庫藏股(子公司神達電腦(股)公司 持有本公司股份)減資變更登記完成事宜
56,3706,神達,104/10/08,13:59:26,新聞稿-神達投控公佈一百零四年九月營收
57,3706,神達,104/10/14,13:31:11,本公司及子公司對單一企業背書保證餘額達新臺幣一千萬元以上 且對其背書保證、長期投資及資金貸與餘額合計數達該本公司最 近期財務報表淨值百分之三十以上
58,3706,神達,104/10/23,17:08:08,公告本公司買回公司股份期間屆滿
59,3706,神達,104/10/28,16:52:34,公告本公司增加持有被控股公司家數
60,3706,神達,104/11/09,15:31:16,新聞稿-神達投控公佈一百零四年十月營收
61,3706,神達,104/11/10,17:34:32,新聞稿-神達投控公佈一百零四年第三季財務報告
62,3706,神達,104/12/09,15:08:57,新聞稿-神達投控公佈一百零四年十一月營收
63,3706,神達,104/12/17,17:02:33,公告本公司增加持有被控股公司家數
64,3706,神達,104/12/17,17:02:50,代子公司Silver Star Developments Ltd.公告 董事會決議新增資金貸與金額美金三仟萬元
65,3706,神達,104/12/28,15:43:29,公告本公司減少持有被控股公司家數
