,公司代號,公司名稱,發言日期,發言時間,主旨
0,6117,迎廣,103/03/25,16:46:12,董事會決議召開本公司一Ｏ三年度股東常會
1,6117,迎廣,103/05/02,12:02:23,董事會決議股利分派
2,6117,迎廣,103/05/23,16:53:50,依台灣證券交易所通知指示因本公司有價證券於集中交易市 場有異常交易情形，公布相關財務業務等重大訊息，以利投 資人區別瞭解。
3,6117,迎廣,103/05/26,12:03:07,本公司依公開發行公司資金貸與及背書保證處理準則第二十五條 第一項第三款規定辦理公告
4,6117,迎廣,103/05/29,15:35:53,更正本公司依公開發行公司資金貸與及背書保證處理準則 第二十五條第一項第三款規定辦理公告
5,6117,迎廣,103/06/27,13:38:23,公告本公司103年股東常會重要決議事項
6,6117,迎廣,103/07/09,16:04:57,公司董事會決議除息基準日及發放日
7,6117,迎廣,103/11/05,15:34:45,本公司依公開發行公司資金貸與及背書保證處理準則 第二十五條第一項第四款規定辦理公告
