,公司代號,公司名稱,發言日期,發言時間,主旨
0,8499,鼎炫-KY,106/10/20,15:29:50,本公司10/25召開上市前業績發表會
1,8499,鼎炫-KY,106/11/03,12:48:27,公告本公司股務代理機構名稱、辦公處所及連絡電話
2,8499,鼎炫-KY,106/11/03,12:48:34,公告本公司股票初次上市現金增資委託代收及存儲價款機構
3,8499,鼎炫-KY,106/11/10,18:07:28,公告本公司股票初次上巿前現金增資發行新股承銷價格
4,8499,鼎炫-KY,106/11/10,21:01:24,本公司依公開發行公司資金貸與及背書保證處理準則 第二十二條第一項第三款規定辦理
5,8499,鼎炫-KY,106/11/22,14:36:03,公告本公司辦理股票初次上市現金增資收足股款暨增資基準日
6,8499,鼎炫-KY,106/11/22,14:36:12,公告本公司辦理初次上市過額配售相關事宜
7,8499,鼎炫-KY,106/11/28,14:16:00,本公司受邀參加富邦證券舉辦之第四季富邦投資論壇
8,8499,鼎炫-KY,106/11/30,17:17:52,公告本公司上市掛牌首五個營業日穩定價格操作結果
